{
  "$schema": "https://json-schema.org/draft/2020-12/schema",
  "$id": "https://archmaker.dev/schemas/rule.schema.json",
  "title": "ArchMaker Rule (RULE-*)",
  "description": "Typed declarative AST evaluating a condition to an effect (block / suggest / derive / change / lock). Operators follow docs/07-validation/operator-spec.md. The condition is a CLOSED union: every operator token belongs to the normative vocabulary in $defs.operator. An unknown operator matches no variant and is rejected here; the runtime must still emit the blocking diagnostic AM-RULE-009 (never evaluate it as false). Shared identifiers ($defs.entityId, $defs.capabilityId) and the severity vocabulary live in common.schema.json and are referenced by $id. Contract state: v0 (draft).",
  "$comment": "Contract v0 (phase R8, AUD-017). Duplicated $defs.entityId/$defs.capabilityId extracted to common.schema.json and referenced by $id; local rule-only $defs kept here. $defs.operator is the closed normative vocabulary (canonical, legacy-migration-only and v1-deferred tokens are annotated per operator). count_gt is legacy (migration-only, rewritten to count with a threshold, never executed by the new runtime); target_is is deferred to v1. additionalProperties:false at every object edge; unknown fields rejected.",
  "type": "object",
  "additionalProperties": false,
  "required": ["id", "documentVersion", "schemaVersion", "when", "action"],
  "properties": {
    "id": {
      "description": "Rule identifier, RULE-<SEGMENT>(-<SEGMENT>)+.",
      "$ref": "#/$defs/ruleId"
    },
    "documentVersion": {
      "description": "Domain document contract version (axis documentVersion).",
      "$ref": "https://archmaker.dev/schemas/common.schema.json#/$defs/documentVersion"
    },
    "schemaVersion": {
      "description": "JSON Schema contract version (axis schemaVersion).",
      "$ref": "https://archmaker.dev/schemas/common.schema.json#/$defs/schemaVersion"
    },
    "severity": {
      "description": "Diagnostic severity emitted by the rule. Canonical vocabulary from common.schema.json (errors-events.md is the single source of truth).",
      "$ref": "https://archmaker.dev/schemas/common.schema.json#/$defs/severity"
    },
    "blocking": {
      "description": "Whether the emitted diagnostic blocks manifest construction. Must be consistent with severity (error => blocking:true; warning/info => blocking:false).",
      "type": "boolean"
    },
    "when": {
      "description": "Boolean condition evaluated over the domain (pipeline stage 8).",
      "$ref": "#/$defs/condition"
    },
    "action": {
      "description": "Effect applied when the condition holds.",
      "$ref": "#/$defs/action"
    },
    "target": {
      "description": "Target step affected by change or derive effects (resolution/objective).",
      "$ref": "https://archmaker.dev/schemas/common.schema.json#/$defs/entityId"
    },
    "allowed": {
      "description": "Options the effect may select on the target.",
      "type": "array",
      "items": {
        "$ref": "https://archmaker.dev/schemas/common.schema.json#/$defs/entityId"
      }
    },
    "diagnosticCode": {
      "description": "AM-* code emitted by the rule; the canonical numeric assignment lives in docs/04-interfaces/errors-events.md (single source).",
      "$ref": "#/$defs/diagnosticCode"
    },
    "note": {
      "description": "Free-form human note. Not part of the canonical hashed payload semantics beyond the document field rules.",
      "type": "string"
    }
  },
  "$defs": {
    "ruleId": {
      "description": "Rule identifier: RULE- prefix plus at least two upper-case alphanumeric segments.",
      "type": "string",
      "pattern": "^RULE-[A-Z0-9]+(-[A-Z0-9]+)+$"
    },
    "diagnosticCode": {
      "description": "Diagnostic code AM-<FAMILY>-<NNN>; catalogued in docs/04-interfaces/errors-events.md.",
      "type": "string",
      "pattern": "^AM-[A-Z]+-[0-9]{3}$"
    },
    "action": {
      "description": "Closed effect vocabulary. block stops construction; suggest informs; derive computes a value; change may reassign the target within allowed; lock freezes the target.",
      "enum": ["block", "suggest", "derive", "change", "lock"]
    },
    "operator": {
      "description": "Closed normative vocabulary of rule operators (names). Canonical/executable: all, any, not, eq, ne, in, required, selected, count, provides. Legacy (migration-only, never executed by the new runtime): count_gt. v1-deferred (not used by the MVP): target_is. Every condition variant constrains its property names to this enum, so an operator token outside it can never validate.",
      "enum": [
        "all",
        "any",
        "not",
        "eq",
        "ne",
        "in",
        "required",
        "selected",
        "count",
        "provides",
        "count_gt",
        "target_is"
      ]
    },
    "targetId": {
      "description": "Export or execution target identifier (DEC-001), e.g. archinstall. Single segment.",
      "type": "string",
      "pattern": "^[a-z0-9][a-z0-9._-]*$"
    },
    "countExpr": {
      "description": "Term operator count: integer expression returning the number of effective selections of a reference. A term, not a boolean; usable as an operand of eq/ne/in.",
      "type": "object",
      "additionalProperties": false,
      "propertyNames": {
        "$ref": "#/$defs/operator"
      },
      "required": ["count"],
      "properties": {
        "count": {
          "$ref": "https://archmaker.dev/schemas/common.schema.json#/$defs/entityId"
        }
      }
    },
    "operand": {
      "description": "A comparison operand: an entity reference (DEC-002 vendor.kind.id), a boolean, an integer or a count expression. Literals are typed; there is no untyped string literal.",
      "oneOf": [
        {
          "$ref": "https://archmaker.dev/schemas/common.schema.json#/$defs/entityId"
        },
        {
          "type": "boolean"
        },
        {
          "type": "integer"
        },
        {
          "$ref": "#/$defs/countExpr"
        }
      ]
    },
    "condition": {
      "description": "Closed boolean-expression union over the supported operators. Exactly one variant matches; any other operator key is rejected.",
      "oneOf": [
        {
          "$ref": "#/$defs/allExpr"
        },
        {
          "$ref": "#/$defs/anyExpr"
        },
        {
          "$ref": "#/$defs/notExpr"
        },
        {
          "$ref": "#/$defs/eqExpr"
        },
        {
          "$ref": "#/$defs/neExpr"
        },
        {
          "$ref": "#/$defs/inExpr"
        },
        {
          "$ref": "#/$defs/requiredExpr"
        },
        {
          "$ref": "#/$defs/selectedExpr"
        },
        {
          "$ref": "#/$defs/countGtExpr"
        },
        {
          "$ref": "#/$defs/providesExpr"
        },
        {
          "$ref": "#/$defs/targetIsExpr"
        }
      ]
    },
    "allExpr": {
      "description": "all(List<Expr>) -> bool: true iff every listed expression is true. minItems 1 (empty conjunction is not representable).",
      "type": "object",
      "additionalProperties": false,
      "propertyNames": {
        "$ref": "#/$defs/operator"
      },
      "required": ["all"],
      "properties": {
        "all": {
          "type": "array",
          "minItems": 1,
          "items": {
            "$ref": "#/$defs/condition"
          }
        }
      }
    },
    "anyExpr": {
      "description": "any(List<Expr>) -> bool: true iff at least one listed expression is true. minItems 1 (empty disjunction is not representable).",
      "type": "object",
      "additionalProperties": false,
      "propertyNames": {
        "$ref": "#/$defs/operator"
      },
      "required": ["any"],
      "properties": {
        "any": {
          "type": "array",
          "minItems": 1,
          "items": {
            "$ref": "#/$defs/condition"
          }
        }
      }
    },
    "notExpr": {
      "description": "not(Expr) -> bool: logical negation of a sub-expression.",
      "type": "object",
      "additionalProperties": false,
      "propertyNames": {
        "$ref": "#/$defs/operator"
      },
      "required": ["not"],
      "properties": {
        "not": {
          "$ref": "#/$defs/condition"
        }
      }
    },
    "eqExpr": {
      "description": "eq(T,T) -> bool: equality of two operands. Exactly two operands.",
      "type": "object",
      "additionalProperties": false,
      "propertyNames": {
        "$ref": "#/$defs/operator"
      },
      "required": ["eq"],
      "properties": {
        "eq": {
          "type": "array",
          "prefixItems": [
            {
              "$ref": "#/$defs/operand"
            },
            {
              "$ref": "#/$defs/operand"
            }
          ],
          "minItems": 2,
          "items": false
        }
      }
    },
    "neExpr": {
      "description": "ne(T,T) -> bool: inequality of two operands. Exactly two operands.",
      "type": "object",
      "additionalProperties": false,
      "propertyNames": {
        "$ref": "#/$defs/operator"
      },
      "required": ["ne"],
      "properties": {
        "ne": {
          "type": "array",
          "prefixItems": [
            {
              "$ref": "#/$defs/operand"
            },
            {
              "$ref": "#/$defs/operand"
            }
          ],
          "minItems": 2,
          "items": false
        }
      }
    },
    "inExpr": {
      "description": "in(T,List<T>) -> bool: membership of a value in a non-empty list.",
      "type": "object",
      "additionalProperties": false,
      "propertyNames": {
        "$ref": "#/$defs/operator"
      },
      "required": ["in"],
      "properties": {
        "in": {
          "type": "array",
          "prefixItems": [
            {
              "$ref": "#/$defs/operand"
            },
            {
              "type": "array",
              "minItems": 1,
              "items": {
                "$ref": "#/$defs/operand"
              }
            }
          ],
          "minItems": 2,
          "items": false
        }
      }
    },
    "requiredExpr": {
      "description": "required(ValueRef) -> bool (canonical, ratified 2026-10-05): true when the referenced entity has cardinality >= 1.",
      "type": "object",
      "additionalProperties": false,
      "propertyNames": {
        "$ref": "#/$defs/operator"
      },
      "required": ["required"],
      "properties": {
        "required": {
          "$ref": "https://archmaker.dev/schemas/common.schema.json#/$defs/entityId"
        }
      }
    },
    "selectedExpr": {
      "description": "selected(Id) -> bool (canonical): true when the option Id is selected in the draft.",
      "type": "object",
      "additionalProperties": false,
      "propertyNames": {
        "$ref": "#/$defs/operator"
      },
      "required": ["selected"],
      "properties": {
        "selected": {
          "$ref": "https://archmaker.dev/schemas/common.schema.json#/$defs/entityId"
        }
      }
    },
    "countGtExpr": {
      "description": "count_gt(ValueRef,integer) -> bool. LEGACY, migration-only: the v5.1 migration rewrites count_gt(Ref,n) to the normalized count term with a threshold (gt(count(Ref), n)); the new runtime never executes count_gt. Retained so inherited documents can be parsed and migrated.",
      "type": "object",
      "additionalProperties": false,
      "propertyNames": {
        "$ref": "#/$defs/operator"
      },
      "required": ["count_gt"],
      "properties": {
        "count_gt": {
          "type": "array",
          "prefixItems": [
            {
              "$ref": "https://archmaker.dev/schemas/common.schema.json#/$defs/entityId"
            },
            {
              "type": "integer",
              "minimum": 0
            }
          ],
          "minItems": 2,
          "items": false
        }
      }
    },
    "providesExpr": {
      "description": "provides(Capability) -> bool (canonical): true when the resolution provides the capability (evaluated in pipeline stage 9).",
      "type": "object",
      "additionalProperties": false,
      "propertyNames": {
        "$ref": "#/$defs/operator"
      },
      "required": ["provides"],
      "properties": {
        "provides": {
          "$ref": "https://archmaker.dev/schemas/common.schema.json#/$defs/capabilityId"
        }
      }
    },
    "targetIsExpr": {
      "description": "target_is(TargetId) -> bool. DEFERRED to v1 (VAL-TARGET): not used by any MVP rule; the schema keeps it representable so v1 documents can be typed without a breaking change. Evaluates the active export/execution target (DEC-001).",
      "type": "object",
      "additionalProperties": false,
      "propertyNames": {
        "$ref": "#/$defs/operator"
      },
      "required": ["target_is"],
      "properties": {
        "target_is": {
          "$ref": "#/$defs/targetId"
        }
      }
    }
  }
}
